{
  "$schema": "http://json-schema.org/draft-07/schema#",
  "title": "ProvenanceCode Spec",
  "type": "object",
  "required": [
    "id",
    "title",
    "status",
    "risk",
    "acceptanceCriteria",
    "affectedPaths",
    "relatedDecisions"
  ],
  "additionalProperties": false,
  "properties": {
    "id": {
      "type": "string",
      "pattern": "^SPEC-\\d{6}$"
    },
    "title": {
      "type": "string",
      "minLength": 1
    },
    "status": {
      "type": "string",
      "enum": [
        "draft",
        "review",
        "approved"
      ]
    },
    "risk": {
      "type": "string",
      "enum": [
        "low",
        "medium",
        "high"
      ]
    },
    "acceptanceCriteria": {
      "type": "array",
      "items": {
        "type": "string",
        "minLength": 1
      }
    },
    "affectedPaths": {
      "type": "array",
      "items": {
        "type": "string",
        "minLength": 1
      }
    },
    "relatedDecisions": {
      "type": "array",
      "items": {
        "type": "string",
        "pattern": "^DEC-\\d{6}$"
      }
    }
  }
}
